Date,Symbol,Signal,Conviction,Commentary,Risk_Flag,Future_Path,Model
2026-02-03,TPLP,STAY AWAY,95%,"Unusual and incomplete data, significantly negative OBV, and high uncertainty suggest a high-risk scenario.",Satta Alert,Real-time Deployment,Groq Llama-3.3-70b (SMI-v1)
2026-02-03,SPCL,STAY AWAY,100%,Insufficient data across all expert analyses makes it impossible to assess SPCL's investment potential or risks accurately.,Satta Alert,Real-time Deployment,Groq Llama-3.3-70b (SMI-v1)
2026-02-03,786,STAY AWAY,100%,"All experts agree that the lack of meaningful data and unusual values (e.g., close price of 0) make it impossible to conduct a thorough analysis, indicating a high risk of systemic failure or margin calls.",Satta Alert,Real-time Deployment,Groq Llama-3.3-70b (SMI-v1)
2026-02-03,AKDSL,STAY AWAY,100%,"Insufficient and incomplete data for a comprehensive analysis, with critical indicators missing or invalid, suggesting potential systemic risk or non-standard financial instrument.",Satta Alert,Real-time Deployment,Groq Llama-3.3-70b (SMI-v1)
2026-02-03,CYAN,STAY AWAY,95%,"Unanimous bearish consensus due to incomplete and potentially erroneous data, indicating a highly uncertain and risky investment environment.",Satta Alert,Real-time Deployment,Groq Llama-3.3-70b (SMI-v1)
2026-02-03,FCEL,STAY AWAY,90%,"Incomplete and potentially erroneous data across critical areas, including price, technical indicators, and settlement data, indicating high risk and uncertainty.",Satta Alert,Real-time Deployment,Groq Llama-3.3-70b (SMI-v1)
2026-02-03,FCSC,STAY AWAY,90%,"Unanimous expert consensus indicates high risk due to incomplete and unusual data, including a close price of 0 and negative OBV, suggesting potential for significant losses.",Satta Alert,Real-time Deployment,Groq Llama-3.3-70b (SMI-v1)
2026-02-03,IREIT,STAY AWAY,90%,"Insufficient and partially null data prevents a thorough analysis, indicating high risk due to lack of information.",Satta Alert,Real-time Deployment,Groq Llama-3.3-70b (SMI-v1)
2026-02-03,JSIL,STAY AWAY,90%,Incomplete and potentially erroneous data makes it impossible to form a reliable opinion on JSIL's performance or future outlook.,Satta Alert,Real-time Deployment,Groq Llama-3.3-70b (SMI-v1)
2026-02-03,MRNS,STAY AWAY,90%,"Incomplete and unusual data suggests high uncertainty and potential systemic risk, advising against investment decisions.",Satta Alert,Real-time Deployment,Groq Llama-3.3-70b (SMI-v1)
