Time,Category,Source,Headline,Sentiment_Score,Sentiment,Market_Impact,URL
2026-02-01 14:11,International,Investing.com,Hotel stocks - here are winners and losers from weak dollar,-0.494,Bearish,Medium,https://www.investing.com/news/stock-market-news/hotel-stocks--here-are-winners-and-losers-from-weak-dollar-4474662
2026-02-01 14:11,International,Investing.com,UBS discusses top themes for media in 2026,0.202,Bullish,Medium,https://www.investing.com/news/stock-market-news/ubs-discusses-top-themes-for-media-in-2026-4473518
2026-02-01 14:11,International,Investing.com,How does a weaker dollar impact gold and Bitcoin?,-0.44,Bearish,Medium,https://www.investing.com/news/commodities-news/how-does-a-weaker-dollar-impact-gold-and-bitcoin-4471026
2026-02-01 14:11,International,Investing.com,Is the U.K. economy on the brink of a recession? BCA Research weighs in.,-0.421,Bearish,Medium,https://www.investing.com/news/economy-news/is-the-uk-economy-on-the-brink-of-a-recession-bca-research-weighs-in-4470698
2026-02-01 14:11,International,Investing.com,French tech company Capgemini says selling US subsidiary,0.0,Neutral,Low,https://www.investing.com/news/stock-market-news/french-tech-company-capgemini-says-selling-us-subsidiary-4477689
2026-02-01 14:11,International,Investing.com,Street Calls of the Week,0.0,Neutral,Low,https://www.investing.com/news/stock-market-news/street-calls-of-the-week-4477688
2026-02-01 14:11,International,Investing.com,India budget makes bet on manufacturing; transaction tax hike spooks markets,0.0,Neutral,Low,https://www.investing.com/news/economy-news/india-budget-to-promote-reforms-as-room-for-spending-shrinks-4477676
2026-02-01 14:11,International,Investing.com,Will the ECB respond to the rising euro? Analyst weighs,0.0,Neutral,Low,https://www.investing.com/news/economy-news/will-the-ecb-respond-to-the-rising-euro-analyst-weighs-4473023
